pref,city,name,zip,addr,phone,note
和歌山県,かつらぎ町,かつらぎ町地域子育て支援センターはぐくみ,,かつらぎ町丁ノ町2156-1,0736-22-0300,
和歌山県,かつらぎ町,三谷こども園子育て支援センター,,かつらぎ町三谷1650,0736-23-3730,
和歌山県,かつらぎ町,佐野こども園子育て支援センター,,かつらぎ町佐野827-1,0736-22-6260,
和歌山県,みなべ町,みなべ町地域子育て支援センターこひつじランド,,みなべ町谷口301-4（みなべ町生涯学習センター内）,0739-74-2711,
和歌山県,上富田町,くまのの森子育て支援センター,,上富田町朝来2402番地の1（くまのの森こども園内）,0739-47-0013,
和歌山県,上富田町,子育て支援センター とんとんルーム,,上富田町岩田1674番地の1（はるかぜ保育所内）,0739-34-2611,
和歌山県,串本町,子育て支援センターにこにこひろば,,串本町上野山143,0735-72-0299,
和歌山県,串本町,子育て支援センターりぼん,,串本町串本388-1,0735-62-5552,
和歌山県,九度山町,子ども子育て支援センター,,九度山町九度山1074,0736-54-9053,
和歌山県,九度山町,集まれ！！Chicks＆Mommy,,九度山町河根118,0736-54-4783,
和歌山県,印南町,いなみっ子交流センター,,印南町印南1986,0738-42-1170,
和歌山県,古座川町,古座川町地域子育て支援センターのびのびひろば,,古座川町高池777（古座川町中央公民館内）,0735-72-3344,
和歌山県,和歌山市,komodo（コモド）,,和歌山市松江775番地の1（河西ほほえみセンター内）,073-456-6003,
和歌山県,和歌山市,いさおKIDS,,和歌山市園部1-1（有功保育園内）,073-464-4320,
和歌山県,和歌山市,さつきランド,,和歌山市中島74-22（さつきこども園内）,073-473-2444,
和歌山県,和歌山市,ほっとルームぐるんぱ,,和歌山市福島487 ルミノーゾふるい1-C,073-452-2303,
和歌山県,和歌山市,もうひとつのさと「ポピンズ」,,和歌山市西高松1丁目1-26 高松ATビル3階,073-435-4555,
和歌山県,和歌山市,ようすいランド,,和歌山市西浜1218-3（ようすい子ども園内）,073-445-6875,
和歌山県,和歌山市,わかば♪,,和歌山市田中町2丁目18-1 CAPビル2階,073-428-2411,
和歌山県,和歌山市,ドレミひろば,,和歌山市田尻493-1（南保健センター併設）,073-488-6767,
和歌山県,和歌山市,ワーカルらんど,,和歌山市加納181-5（シカゴテラス内）,070-5654-8615,
和歌山県,和歌山市,育ちのえき くすの木,,和歌山市屛風丁17（市民図書館4階）,073-402-0727,
和歌山県,太地町,ふれあいルーム,,太地町大字太地3431番地（子育て支援ハウス）,0735-59-2335,
和歌山県,岩出市,子育て支援センターあいあい,,岩出市金池92（岩出市総合保健福祉センター内）,0736-61-2983,
和歌山県,岩出市,子育て支援センターいわで,,岩出市清水196-1（岩出保育所内）,0736-62-3362,
和歌山県,広川町,ちびっこクラブ,,広川町山本1521-4（ポッポ保育園内）,0737-62-5152,
和歌山県,広川町,なかよしランド,,広川町広583（なかよし子ども園内）,0737-62-2610,
和歌山県,御坊市,地域子育て支援センターぴよぴよ,,御坊市島333（わかば保育園内）,0738-23-4828,
和歌山県,新宮市,新宮市子育て支援センター,,新宮市新宮451番地,0735-29-7246,
和歌山県,日高川町,かわべ地域子育て支援センター,,日高川町小熊6076（かわべ保育所敷地内）,0738-22-8560,
和歌山県,日高川町,なかつ地域子育て支援センター,,日高川町高津尾1071（なかつ保育所内）,0738-54-2030,
和歌山県,日高町,日高町子育て支援センター,,日高町大字小中1308（日高町保健福祉総合センター内）,0738-70-4140,
和歌山県,有田川町,地域子育て支援センター,,有田川町下津野245-1,0737-52-5474,
和歌山県,有田市,つどいの広場「きらきら広場」,,有田市港町63-2（港町児童館内）,0737-82-3590,
和歌山県,有田市,つどいの広場「にこにこ広場」,,有田市初島町浜1792（砂浜児童館内）,0737-83-1596,
和歌山県,有田市,有田市地域子育て支援センター,,有田市箕島27（有田市子育て世代活動支援センター内）,0737-83-1470,
和歌山県,橋本市,こののほっとルーム,,橋本市神野々368-2（神野々ふれあい会館内）,0736-32-9345,
和歌山県,橋本市,さくらんぼルーム,,橋本市隅田町上兵庫267（すみだこども園内）,0736-33-1121,
和歌山県,橋本市,たまごくらぶ,,橋本市高野口町名古曽849（香久の実保育園内）,0736-43-1015,
和歌山県,橋本市,ひまわりルーム,,橋本市高野口町応其232-1（応其こども園内）,0736-44-3322,
和歌山県,橋本市,カナカナクラブ,,橋本市東家2-1-23（橋本こども園内）,0736-33-7070,
和歌山県,橋本市,キオラクラブ,,橋本市高野口町向島166（高野口こども園内）,0736-43-1305,
和歌山県,橋本市,ハッピールーム,,橋本市清水388-1（学文路さつきこども園内）,0736-26-8669,
和歌山県,橋本市,ポトフのおなべ,,橋本市あやの台2-30-2（あやの台保育園内）,0736-34-7870,
和歌山県,海南市,五月山こども園子育て支援センター,,海南市北赤坂3番地1（五月山こども園内）,073-483-7778,
和歌山県,海南市,海南市子育て支援センターきらら,,海南市沖野々434番地（きらら子ども園内）,073-487-4660,
和歌山県,海南市,海南市子育て支援センターこじか,,海南市下津町上2番地1（こじか保育所内）,073-492-1584,
和歌山県,海南市,海南市子育て支援センターみらい,,海南市日方1273番地22,073-483-1522,
和歌山県,湯浅町,地域子育て支援センター,,湯浅町青木275番地1（ゆあさこども園内）,0737-63-6066,
和歌山県,田辺市,田辺市地域子育て支援センターちかの,,田辺市中辺路町近露1181,0739-65-0204,
和歌山県,田辺市,田辺市地域子育て支援センター愛あい,,田辺市天神崎3-28,0739-22-9285,
和歌山県,由良町,由良町地域子育て支援センター,,由良町畑162番地の3（由良町立ゆらこども園内）,0738-65-2155,
和歌山県,白浜町,しらとり保育園,,白浜町十九淵52-1,0739-45-1404,
和歌山県,白浜町,堅田第二保育園,,白浜町堅田714番地1,0739-45-8498,
和歌山県,白浜町,日置保育園,,白浜町日置340番地の1,0739-52-2128,
和歌山県,白浜町,湯崎保育園,,白浜町2927番地の263,0739-43-0921,
和歌山県,白浜町,白浜保育園,,白浜町190,0739-42-3503,
和歌山県,紀の川市,レイモンド子育て支援センター,,紀の川市古和田240,0736-79-7228,
和歌山県,紀の川市,桃山子育て支援センター,,紀の川市桃山町元386-1,0736-66-0404,
和歌山県,紀の川市,那賀子育て支援センター,,紀の川市名手市場737-3,0736-75-2331,
和歌山県,紀美野町,紀美野町子育て支援センター,,紀美野町下佐々1408番地4（紀美野町総合福祉センター内）,073-489-6700,
和歌山県,美浜町,子育てつどいのへや,,美浜町吉原602-1,0738-22-3650,
和歌山県,那智勝浦町,那智勝浦町地域子育て支援センター,,那智勝浦町天満441-8（体育文化会館内）,0735-52-0224,
和歌山県,高野町,高野町子育て支援センター,,高野町高野山26-2（高野山こども園舎内）,0736-56-2320,
