pref,city,name,zip,addr,phone,note
東京都,立川市,にしすな子育てひろば,1900033,立川市一番町6-8-37 西砂児童館,042-531-0433,
東京都,立川市,にじっこ子育てひろば,1900034,立川市西砂町6-12-10 西砂学習館内,042-531-4505,
東京都,立川市,はごろも子育てひろば,1900021,立川市羽衣町2-44-16 羽衣児童館,042-526-2336,
東京都,立川市,ひまわり子育てひろば,1900031,立川市砂川町1-52-7 砂川学習館内,,
東京都,立川市,ふじみ子育てひろば,1900013,立川市富士見町7-7-12 富士見児童館,042-525-9020,
東京都,立川市,わかば子育てひろば,1900001,立川市若葉町4-25-114 若葉児童館,042-536-1400,
東京都,練馬区,あいあいあい南大泉,1780064,練馬区南大泉1丁目44番16号,,
東京都,練馬区,あいあいあい東大泉,1780063,練馬区東大泉3丁目41番7号 和田ﾋﾞﾙ201号,,
東京都,練馬区,あいあいあい石神井台,1770045,練馬区石神井台5丁目9番6号,,
東京都,練馬区,かるがも親子・氷川台,1790084,練馬区氷川台3丁目24番17号 石野ﾋﾞﾙ1階,,
東京都,練馬区,こどもくらぶじゃんけんぽん,1780065,練馬区西大泉2丁目12番5号,,
東京都,練馬区,こどもフローラ,1770042,練馬区下石神井2丁目35番16号,,
東京都,練馬区,ほっぷ・すてっぷ,1770035,練馬区南田中1丁目6番14号 ﾋｶﾘﾊｲﾑ102号,,
東京都,練馬区,三原台児童館,1770031,練馬区三原台2-11-29,03-3924-8796,
東京都,練馬区,上石神井児童館,1770044,練馬区上石神井1-5-2,03-3929-0999,
東京都,練馬区,中村児童館,1760024,練馬区中村2-25-3,,
東京都,練馬区,光が丘なかよし児童館,1790072,練馬区光が丘2-9-6,03-5997-7720,
東京都,練馬区,光が丘ぴよぴよ（ひろば室）,1790072,練馬区光が丘5丁目2番5-105号,,
東京都,練馬区,光が丘児童館,179-0072,東京都練馬区光が丘1-3-1,03-3975-7137,
東京都,練馬区,光が丘児童館ぴよぴよ,1790072,練馬区光が丘1丁目3番1号 光が丘児童館併設,,
東京都,練馬区,北大泉児童館,178-0062,東京都大泉町4-15-15,03-3921-4856,
東京都,練馬区,北大泉児童館ぴよぴよ,1780062,練馬区大泉町4丁目15番15号 北大泉児童館2階,,
東京都,練馬区,北町はるのひ児童館,179-0081,東京都練馬区北町,03-3933-5100,
東京都,練馬区,北町児童館,179-0081,東京都練馬区北町1-19-17,03-3931-5481,
東京都,練馬区,北町児童館,1790081,練馬区北町1-19-17,03-3931-5481,
東京都,練馬区,南田中児童館,1770035,練馬区南田中5-15-25,03-3995-5534,
東京都,練馬区,土支田児童館,1790076,練馬区土支田2-32-8,03-3925-4784,
東京都,練馬区,大泉にじのいろ保育園,1780062,練馬区大泉町6-30-3,,
東京都,練馬区,大泉ぴよぴよ,1780063,練馬区東大泉5丁目35番1号,,
東京都,練馬区,子育てのひろば 光が丘ぴよぴよ（ひろば室）,179-0072,東京都練馬区光が丘5-2-5-105,03-3979-8101,
東京都,練馬区,子育てのひろば 光が丘児童館ぴよぴよ,179-0072,東京都練馬区光が丘1-3-1,03-3975-7137,
東京都,練馬区,子育てのひろば 北大泉児童館ぴよぴよ,178-0062,東京都練馬区大泉町4-15-15,03-3921-4856,
東京都,練馬区,子育てのひろば 大泉ぴよぴよ,178-0063,東京都練馬区東大泉5-35-1,03-3925-6716,
東京都,練馬区,子育てのひろば 春日町南地区区民館ぴよ,179-0074,東京都練馬区春日町5-20-25,03-3926-4974,
東京都,練馬区,子育てのひろば 田柄地区区民館ぴよぴよ,179-0073,東京都練馬区田柄3-28-13,03-3926-4934,
東京都,練馬区,子育てのひろば 立野地区区民館ぴよぴよ,177-0054,東京都練馬区立野町15-42,03-3928-6217,
東京都,練馬区,子育てのひろば 練馬ぴよぴよ（ひろば室）,176-0012,東京都練馬区豊玉北5-18-12,03-3993-8200,
東京都,練馬区,子育てのひろば 貫井ぴよぴよ 独立専用施設,176-0021,東京都練馬区貫井3-25-15,03-3577-9823,
東京都,練馬区,子育てのひろば 関ぴよぴよ,177-0051,東京都練馬区関町北1-21-15,03-5991-4711,
東京都,練馬区,平和台児童館,1790083,練馬区平和台2-18-14,03-3933-0297,
東京都,練馬区,春日町南地区区民館ぴよぴよ,1790074,練馬区春日町5丁目20番25号,,
東京都,練馬区,未来こどもランドすまいる石神井,1770041,練馬区石神井町3-27-14,,
東京都,練馬区,未来こどもランドすまいる高野台,1770033,練馬区高野台3丁目12番9号 ﾒｿﾞﾝ･ﾄﾞ･ｻﾝﾄﾛﾍﾟ1階,,
東京都,練馬区,東大泉児童館,1780063,練馬区東大泉7-20-1,03-3921-9128,
東京都,練馬区,栄町児童館,176-0006,東京都練馬区栄町40-7,03-3994-3287,
東京都,練馬区,栄町児童館,1760006,練馬区栄町40-7,03-3994-3287,
東京都,練馬区,民設子育てのひろば あいあいあい南大泉 民家,178-0064,東京都練馬区南大泉1-44-16,03-6750-7081,
東京都,練馬区,民設子育てのひろば あいあいあい東大泉,178-0063,東京都練馬区東大泉3-41-7-201,03-3924-3508,
東京都,練馬区,民設子育てのひろば あいあいあい石神井 民家,177-0045,東京都練馬区石神井台5-9-6,03-6767-2588,
東京都,練馬区,民設子育てのひろば かるがも親子の家,179-0081,東京都練馬区北町2-21-5,090-5777-0104,
東京都,練馬区,民設子育てのひろば かるがも親子・氷川台,179-0084,東京都練馬区氷川台3-24-17,03-3934-5314,
東京都,練馬区,民設子育てのひろば さくらひろば,176-0012,東京都練馬区豊玉北1-12-3,03-5999-0209,
東京都,練馬区,民設子育てのひろば しろくまひろば,177-0032,東京都練馬区谷原5-16-38,03-6913-3308,
東京都,練馬区,民設子育てのひろば ろんろんのひろば 民家,177-0045,東京都練馬区石神井台7-28-10,080-9771-6060,
東京都,練馬区,民設子育てのひろば 千川バンビ 民家,177-0042,東京都練馬区下石神井１-１-３,03-6807-0977,
東京都,練馬区,民設子育てのひろば 大泉子育てのひろば 空き店舗,178-0061,東京都練馬区大泉学園町7-13-17,03-5935-7453,
東京都,練馬区,民設子育てのひろば 小竹さくらんぼひろば 民家,176-0004,東京都練馬区小竹町2-25-3,080-7054-7197,
東京都,練馬区,民設子育てのひろば 平和台子育てひろば,179-0085,東京都練馬区早宮2-16-31クロープ平和台202,03-6906-6166,
東京都,練馬区,民設子育てのひろば 未来こどもランドすま,177-0033,,03-5923-7555,
東京都,練馬区,民設子育てのひろば 未来こどもランドすま 民家,177-0041,東京都練馬区石神井町3-27-14,03-3995-5575,
東京都,練馬区,民設子育てのひろば 谷原いすきあ 民家,177-0032,東京都練馬区谷原5-1-20,070-1300-5120,
東京都,練馬区,民設子育てのひろば ３丁目いすきあ 民家,178-0063,東京都練馬区東大泉3-11-7,03-6755-6029,
東京都,練馬区,田柄地区区民館ぴよぴよ,1790073,練馬区田柄3丁目28番13号,,
東京都,練馬区,石神井児童館,177-0041,東京都練馬区石神井町7-28-21,03-3996-3800,
東京都,練馬区,石神井児童館,1770041,練馬区石神井町7-28-21,03-3996-3800,
東京都,練馬区,石神井台児童館,1770045,練馬区石神井台2-18-13,03-3995-8267,
東京都,練馬区,立野地区区民館ぴよぴよ,1770054,練馬区立野町15番42号 立野地区区民館2階,,
東京都,練馬区,練馬ぴよぴよ（ひろば室）,1760012,練馬区豊玉北5-18-12,,
東京都,練馬区,西大泉児童館,1780065,練馬区西大泉3-21-16,03-3924-9537,
東京都,練馬区,関ぴよぴよ,1770051,練馬区関町北1丁目21番15号,,
東京都,練馬区,関町児童館,177-0053,東京都関町南4-15-7-102,03-3920-1601,
東京都,練馬区,関町児童館,1770053,練馬区関町南4-15-7-102,03-3920-1601,
東京都,羽村,しらうめ保育園,2050014,羽村市羽東1-29-16,,
東京都,羽村,太陽の子保育園,2050011,羽村市五ﾉ神3-15-7,,
東京都,羽村,子育てひろば たつの子,2050011,羽村市五ﾉ神2-6-8,,
東京都,羽村,東児童館,2050023,羽村市神明台3-30-2,,
東京都,羽村,羽村たつの子保育園,2050011,羽村市五ﾉ神2-6-20,,
東京都,羽村市,中央児童館,2050015,羽村市羽中3-6-19,042-554-4552,
東京都,羽村市,太陽の子保育園子育てひろば,205-0011,東京都羽村市五ノ神3-15-7,042-555-5780,
東京都,羽村市,子育てひろば たつのこ,205-0011,東京都羽村市五ノ神2-6-20,042-555-9080,
東京都,羽村市,西児童館,2050001,羽村市小作台5-28-3,042-554-7578,
東京都,荒川区,Coco-ogu子育て交流サロン 民家,116-0011,東京都荒川区西尾久2-1-5-1F,03-3894-4588,
東京都,荒川区,ami-ami子育て交流サロン「あかちゃん天国」,116-0014,東京都荒川区東日暮里5-18-8,03-6806-5278,
東京都,荒川区,amiーami子育て交流サロン,1160014,荒川区東日暮里5-18-8,,
東京都,荒川区,ilonaおやこの縁側子育て交流サロン 民家,116-0001,東京都荒川区町屋4-16-7,03-3800-2693,
東京都,荒川区,きらきら子育て交流サロン「あかちゃん天国」,116-0002,東京都荒川区荒川5-12-10,03-3805-5742,
東京都,荒川区,にじの森保育園子育て交流サロン「あかちゃん天国」,116-0003,東京都荒川区南千住8-13-1,03-6806-7900,
東京都,荒川区,はなみずき保育園子育て交流サロン,1160003,荒川区南千住8-5-5,,
東京都,荒川区,ひぐらしふれあい館 親子ふれあいひろば,116-0014,東京都荒川区東日暮里6-28-15,03-3801-7091,
東京都,荒川区,みんなの実家＠まちや子育て交流サロン 民家,116-0001,東京都荒川区町屋5-5-5,03-3809-4035,
東京都,荒川区,ゆいの森子どもひろば,116-0002,東京都荒川区荒川2-50-1,03-3891-4349,
東京都,荒川区,ドン・ボスコ保育園子育て交流サロン,1160002,荒川区荒川3-11-1,,
東京都,荒川区,ドン・ボスコ保育園子育て交流サロン「あかちゃん天国」,116-0002,東京都荒川区荒川3-11-1,03-3801-8999,
東京都,荒川区,南千住7-1-1ブランズタワー（ア 南千住駅前ふれあい館 親子ふれあいひろば,116-0003,,03-3803-0571,
東京都,荒川区,南千住ふれあい館 親子ふれあいひろば,116-0003,東京都荒川区南千住6-36-13,03-3807-1131,
東京都,荒川区,南千住七丁目保育園子育て交流サロン「すく,116-0003,東京都荒川区南千住7-20-13,03-5615-0531,
東京都,荒川区,南千住七丁目保育園子育て交流サロン「すくすく」,1160003,荒川区南千住7-20-13,,
東京都,荒川区,南千住駅前保育所  おひさま保育園子育て交流サロン「汽車ぽっぽ」,1160003,荒川区南千住4-3-2,,
東京都,荒川区,南千住駅前保育所 おひさま保育園子育て交,116-0003,東京都荒川区南千住4-3-2,03-5615-3088,
東京都,荒川区,夕やけこやけふれあい館 親子ふれあいひろ,116-0014,東京都荒川区東日暮里3-11-19,03-3801-0715,
東京都,荒川区,子ども村：ふぁみ～る子育て交流サロン 民家,116-0001,東京都荒川区町屋2-21-2 フレスコ町屋201,03-6240-8571,
東京都,荒川区,子育て交流サロンおひさま,1160003,荒川区南千住8-9-3,,
東京都,荒川区,小台橋保育園子育て交流サロン,1160011,荒川区西尾久6-9-7,,
東京都,荒川区,小台橋保育園子育て交流サロン「あかちゃん天国」,116-0012,東京都荒川区西尾久6-9-7,03-6807-7314,
東京都,荒川区,尾久ふれあい館 親子ふれあいひろば,116-0011,東京都荒川区西尾久2-25-13,03-3809-2511,
東京都,荒川区,峡田ふれあい館 親子ふれあいひろば,116-0002,東京都荒川区荒川3-3-10,03-3807-2886,
東京都,荒川区,日暮里保育園子育て交流サロンわたぼうし,116-0012,東京都荒川区西日暮里2-2-7,03-5604-9369,
東京都,荒川区,東尾久1-18-19 コーワコーポ1 えん子育て交流サロン 民家,116-0012,,090-4834-6078,
東京都,荒川区,東尾久本町通りふれあい館 親子ふれあいひ,116-0012,東京都荒川区東尾久2-37-14,03-3893-8001,
東京都,荒川区,汐入おもちゃ図書館子育て交流サロン 空き店舗,116-0003,東京都荒川区南千住8-12-5-109,03-5615-4815,
東京都,荒川区,汐入こども園おひさま,116-0003,東京都荒川区南千住８－９－３,03-3891-2455,
東京都,荒川区,汐入ふれあい館 親子ふれあいひろば,116-0003,東京都荒川区南千住8-2-2,03-3806-9928,
東京都,荒川区,熊野前ひろば館親子ふれあいひろば,1160012,荒川区東尾久5-9-3,03-3893-2362,
東京都,荒川区,熊野前保育園子育て交流サロン,1160012,荒川区東尾久8-23-9,,
東京都,荒川区,熊野前保育園子育て交流サロン「あかちゃん天国」,116-0012,東京都荒川区東尾久8-23-9,03-3800-7135,
東京都,荒川区,町屋ふれあい館 親子ふれあいひろば,116-0001,東京都荒川区町屋1-35-8,03-3800-2011,
東京都,荒川区,石浜ふれあい館 親子ふれあいひろば,116-0003,東京都荒川区南千住3-28-2,03-3805-5301,
東京都,荒川区,花の木ひろば館親子ふれあいひろば,1160002,荒川区荒川5-50-5,03-3895-6923,
東京都,荒川区,荒川おもちゃ図書館子育て交流サロン「あかちゃん天国」,116-0003,東京都荒川区南千住1-13-20,03-3802-3338,
東京都,荒川区,荒川区子ども家庭総合センター,1160002,荒川区荒川1-50-17,,
東京都,荒川区,荒木田ふれあい館 親子ふれあいひろば,116-0001,東京都荒川区町屋6-13-2,03-3800-1981,
東京都,荒川区,西尾久ふれあい館 親子ふれあいひろば,116-0011,東京都荒川区西尾久8-33-31,03-3810-6219,
東京都,荒川区,西日暮里4-16-3 ファミールカ らぶゆあせるふ子育て交流サロン 民家,116-0013,,090-5423-7920,
東京都,荒川区,西日暮里ふれあい館 親子ふれあいひろば,116-0013,東京都荒川区西日暮里6-24-4,03-3819-6945,
東京都,荒川区,西日暮里二丁目ひろば館親子ふれあいひろば,1160013,荒川区西日暮里2-32-25ひぐらし小併設,,
東京都,荒川区,親子ふれあいひろば(南千住ふれあい館),1160003,荒川区南千住6-36-13,,
東京都,荒川区,親子ふれあいひろば(南千住駅前ふれあい館),1160003,荒川区南千住7-1-1ｱｸﾚｽﾃｨ南千住2F,,
東京都,荒川区,親子ふれあいひろば(夕やけこやけふれあい館),1160014,荒川区東日暮里3-11-19,,
東京都,荒川区,親子ふれあいひろば(尾久ふれあい館),1160011,荒川区西尾久2-25-13,,
東京都,荒川区,親子ふれあいひろば(峡田ふれあい館),1160002,荒川区荒川3-3-10,,
東京都,荒川区,親子ふれあいひろば(東日暮里ふれあい館),1160014,荒川区東日暮里1-17-13,,
東京都,荒川区,親子ふれあいひろば(汐入ふれあい館),1160003,荒川区南千住8-2-2,,
東京都,荒川区,親子ふれあいひろば(町屋ふれあい館),1160001,荒川区町屋1-35-8,,
東京都,荒川区,親子ふれあいひろば(石浜ふれあい館),1160003,荒川区南千住3-28-2,,
東京都,荒川区,親子ふれあいひろば(荒川山吹ふれあい館),1160002,荒川区荒川7-6-8,,
東京都,荒川区,親子ふれあいひろば(荒木田ふれあい館),1160001,荒川区町屋6-13-2,,
東京都,荒川区,親子ふれあいひろば(西尾久ふれあい館),1160011,荒川区西尾久8-33-31,,
東京都,荒川区,親子ふれあいひろば(西日暮里ふれあい館),1160013,荒川区西日暮里6-24-4,,
東京都,荒川区,７時間 ※祝日は休 荒川山吹ふれあい館 親子ふれあいひろば,116-0002,東京都荒川区荒川7-6-8,03-3805-2860,
東京都,葛飾区,03-5,849-5381,,03-5849-5381,
東京都,葛飾区,Gキッズルーム,1240022,葛飾区奥戸8-2-4,,
東京都,葛飾区,ありんこクラブ,1250053,葛飾区鎌倉1-21-6,03-5876-8282,
東京都,葛飾区,いろは,1250062,葛飾区青戸4-15-14,,
東京都,葛飾区,おひさまひろば,125-0054,東京都葛飾区高砂7-15-11,03-5648-3150,
東京都,葛飾区,おひさま広場,124-0012,東京都葛飾区水元1-12-14,03-3600-7089,
東京都,葛飾区,からこる,1240025,葛飾区西新小岩3-37-27,03-3696-2637,
東京都,葛飾区,かるがも,124-0013,東京都葛飾区東立石3-3-15,03-3694-5439,
東京都,葛飾区,きらきら,124-0023,東京都葛飾区東新小岩3-14-1,03-3697-0170,
東京都,葛飾区,けやき,1250062,葛飾区青戸3-13-25,03-3603-7873,
東京都,葛飾区,こぶた広場,1250054,葛飾区高砂5-48-4,03-3607-1442,
東京都,葛飾区,さん・サン広場,1250051,葛飾区新宿4-4-16,,
東京都,葛飾区,すくすくひろば,1810013,三鷹市下連雀4-19-6,03-3696-4519,
東京都,葛飾区,すくすくプラザ西新小岩（子ども未来プラザ東,124-0025,葛飾区西新小岩４丁目３３番２号,03-5698-1700,
東京都,葛飾区,すくすくプラザ鎌倉（子ども未来プラザ鎌倉）,125-0053,葛飾区鎌倉１－７－３,03-3658-1800,
東京都,葛飾区,すまいる,125-0002,東京都葛飾区西亀有3-31-9,03-6662-6131,
東京都,葛飾区,そあ・こどもコミュニティセンター,1250032,葛飾区水元3-13-20,03-5848-3950,
東京都,葛飾区,たんぽぽ広場,125-0035,東京都葛飾区南水元4-18-11,03-5876-6474,
東京都,葛飾区,ちいろば,124-0021,東京都葛飾区細田3-16-5,03-6458-0748,
東京都,葛飾区,つどい,124-0012,東京都葛飾区立石2-31-17,03-5875-6371,
東京都,葛飾区,つどい（南水元）,125-0035,東京都葛飾区南水元2-25-6,03-5876-4360,
東京都,葛飾区,てんとうむし,124-0023,東京都葛飾区東新小岩7-2-8,03-3692-8073,
東京都,葛飾区,とまり木,124-0024,東京都葛飾区新小岩3-13-23,03-3651-3152,
東京都,葛飾区,どんぐりひろば,125-0032,東京都葛飾区水元2-3-19,03-5876-4856,
東京都,葛飾区,なかよしひろば,1240011,葛飾区四つ木5-13-16,,
東京都,葛飾区,にこにこ,125-0062,東京都葛飾区青戸4-24-20,03-5650-6145,
東京都,葛飾区,のびのび広場中道（中道児童館）,124-0002,東京都葛飾区西亀有１－２－７,03-3604-6561,
東京都,葛飾区,のびのび広場亀有（亀有児童館）,125-0061,葛飾区亀有１丁目１７番５号,03-3604-7756,
東京都,葛飾区,のびのび広場南奥戸（南奥戸児童館）,124-0022,葛飾区奥戸２丁目３０番１１号,03-5698-1707,
東京都,葛飾区,のびのび広場南新宿（南新宿児童館）,125-0051,葛飾区新宿１丁目２３番４号,03-5699-1333,
東京都,葛飾区,のびのび広場堀切（堀切児童館）,124-0006,東京都葛飾区堀切１－９－１８,03-5698-1706,
東京都,葛飾区,のびのび広場宝町（宝町児童館）,124-0005,東京都葛飾区宝町１－５－１,03-5698-1703,
東京都,葛飾区,のびのび広場小菅（小菅児童館）,124-0001,葛飾区小菅２丁目１９番１号,03-3604-2645,
東京都,葛飾区,のびのび広場幸田（幸田児童館）,125-0031,葛飾区西水元２丁目１６番１０号,03-5699-1244,
東京都,葛飾区,のびのび広場新柴又（新柴又児童館）,125-0052,葛飾区柴又５丁目３３番８号,03-5694-2982,
東京都,葛飾区,のびのび広場新水元（新水元児童館）,125-0033,葛飾区東水元３丁目５番７号,03-5699-1260,
東京都,葛飾区,のびのび広場末広（末広児童館）,125-0042,葛飾区金町５丁目４番１号,03-5699-1275,
東京都,葛飾区,のびのび広場東堀切（東堀切児童館）,124-0004,東京都葛飾区東堀切２－２０－８,03-3602-6808,
東京都,葛飾区,のびのび広場東奥戸（東奥戸児童館）,124-0022,葛飾区奥戸４丁目２０番１１号,03-5698-1705,
東京都,葛飾区,のびのび広場東金町（東金町児童館）,125-0041,葛飾区東金町５丁目２２番１８号,03-5699-1314,
東京都,葛飾区,のびのび広場柴又（柴又児童館）,125-0052,葛飾区柴又２丁目４番５号,03-5699-1257,
東京都,葛飾区,のびのび広場白鳥（白鳥児童館）,124-0002,東京都葛飾区西亀有１丁目１８番６号,03-3602-3452,
東京都,葛飾区,のびのび広場花の木（花の木児童館）,125-0035,葛飾区南水元３丁目７番１号,03-5699-1298,
東京都,葛飾区,のびのび広場西亀有（西亀有児童館）,125-0002,葛飾区西亀有４丁目２４番１号,03-5616-1776,
東京都,葛飾区,のびのび広場西奥戸（西奥戸児童館）,124-0022,葛飾区奥戸１丁目１２番１号,03-5698-1704,
東京都,葛飾区,のびのび広場鎌倉（鎌倉児童館）,125-0053,葛飾区鎌倉２丁目６番２０号,03-5694-2292,
東京都,葛飾区,のびのび広場青戸中央（青戸中央児童館）,125-0062,東京都葛飾区青戸６－１６－１２,03-3604-6306,
東京都,葛飾区,のびのび広場青戸（青戸児童館）,125-0062,東京都葛飾区青戸３－１０－５,03-3602-0221,
東京都,葛飾区,のびのび広場高砂（高砂児童館）,125-0054,葛飾区高砂５丁目６番７号,03-3627-6948,
東京都,葛飾区,ひだまり広場,1250041,葛飾区東金町1-14-5,,
東京都,葛飾区,ひまわり（東金町）,1250041,葛飾区東金町1-3-1,03-5876-3621,
東京都,葛飾区,ひまわり（細田）,1240021,葛飾区細田3-9-26,03-3673-7550,
東京都,葛飾区,ぶどうの会,1250054,葛飾区高砂2-3-7,03-3673-7110,
東京都,葛飾区,まるる,1250041,葛飾区東金町3-8-1,03-5699-1224,
東京都,葛飾区,めばえ,125-0042,東京都葛飾区金町4-10-14,03-3600-6490,
東京都,葛飾区,ゆうゆう,1250052,葛飾区柴又2-2-9,03-3608-5558,
東京都,葛飾区,よつばのひろば,124-0013,東京都葛飾区東立石4-45-5,03-3692-0897,
東京都,葛飾区,りの,124-0012,東京都葛飾区立石8-18-7,03-5671-1033,
東京都,葛飾区,りぼん,1240023,葛飾区東新小岩5-16-2,,
東京都,葛飾区,りりおっこぷらす,1250061,葛飾区亀有3-16-5,03-5629-0513,
東京都,葛飾区,りりおっこぷらす金町,125-0041,東京都葛飾区東金町2-6-19,03-5876-9308,
東京都,葛飾区,りりおっこぷらす高砂,125-0054,東京都葛飾区高砂6-4-15,03-3608-3399,
東京都,葛飾区,りんごひろば,1250042,葛飾区金町2-19-6,03-3607-2800,
東京都,葛飾区,れいんぼー,1250042,葛飾区金町4-20-13,03-3600-8511,
東京都,葛飾区,わくわくひろば,1250006,葛飾区堀切7-8-3,03-6662-2201,
東京都,葛飾区,わらびー,124-0011,東京都葛飾区立石1-4-10,03-5875-6030,
東京都,葛飾区,オレンジ広場,1250041,葛飾区東金町3-36-15,03-3607-0889,
東京都,葛飾区,子育て、育自センター,1240023,葛飾区東新小岩7-2-8,,
東京都,葛飾区,子育てひろば いろは,125-0062,東京都葛飾区青戸４－１５－１４,03-6240-7591,
東京都,葛飾区,子育てひろば のぞみ,1250061,葛飾区亀有1-27-2 さくら学園保育所,,
東京都,葛飾区,子育てひろば ひよこ,124-0022,東京都葛飾区奥戸5-2-1,03-5654-9330,
東京都,葛飾区,子育てひろば季の風リアン,125-0002,東京都葛飾区西亀有4-8-19,03-5856-2447,
東京都,葛飾区,季の風（きのかぜ）,1250002,葛飾区西亀有4-8-19,,
東京都,葛飾区,新小岩2-1-8 びゅうリエット新 ほほえみひろば,124-0024,,03-6231-5923,
東京都,葛飾区,東新小岩5-16-2 新小岩北集い りぼん,124-0023,,03-5654-6100,
東京都,葛飾区,秋桜,125-0041,東京都葛飾区東金町2-13-10,03-5876-6313,
東京都,葛飾区,秋桜（こすもす）,1250041,葛飾区東金町2-13-10,,
東京都,葛飾区,金町幼稚園子育てひろば,1250042,葛飾区金町4-10-14,,
東京都,西多摩郡日の出町,志茂町児童館乳幼児活動,1900182,西多摩郡日の出町平井1254-1,,
東京都,西多摩郡瑞穂町,あすなろ児童館,1901211,東京都西多摩郡瑞穂町大字石畑1837,,
東京都,西東京市,のどか広場,2020005,西東京市住吉町六丁目15番6号 住吉会館ﾙﾋﾟﾅｽ2階,,
東京都,西東京市,ひばりが丘児童センター,2020001,西東京市ひばりが丘3-1-25,042-465-4540,
東京都,西東京市,ひばりが丘北児童センター,2020002,西東京市ひばりが丘北1-6-8,042-423-4686,
東京都,西東京市,ピッコロ広場,1880011,西東京市田無町三丁目7番2号 ｺｰﾙ田無3階,,
東京都,西東京市,下保谷児童センター,2020004,西東京市下保谷4-3-20,042-422-8346,
東京都,西東京市,中町児童館,2020013,西東京市中町4-4-1,042-422-8800,
東京都,西東京市,保谷柳沢児童館,2020022,西東京市柳沢2-6-11,042-468-7892,
東京都,西東京市,北原児童館,1880003,西東京市北原町1-16-2,042-461-2156,
東京都,西東京市,地域子育て支援センター けやき,1880004,西東京市西原町4-5-96,042-464-3823,
東京都,西東京市,地域子育て支援センター すみよし,2020005,西東京市住吉町3-14-14,042-421-8146,
東京都,西東京市,地域子育て支援センター なかまち,2020013,西東京市中町4-4-16,042-422-4880,
東京都,西東京市,地域子育て支援センター ひがし,2020012,西東京市東町2-4-13,042-421-9913,
