pref,city,name,zip,addr,phone,note
東京都,府中市,交流ひろば,1830023,府中市宮町1-50 くるる3F,042-354-8700,
東京都,府中市,光明高倉保育園,1830033,府中市分梅町1丁目31番地,042-330-2005,
東京都,府中市,地域子育て支援センター「はぐ きたやま」,183-0041,東京都府中市北山町３－２７－９,042-573-2512,
東京都,府中市,地域子育て支援センター「はぐ さんぼんぎ」,183-0055,東京都府中市府中町３－２３－１,042-365-6212,
東京都,府中市,地域子育て支援センター「はぐ ひがし」,183-0005,東京都府中市若松町３－２１－４,042-362-5200,
東京都,府中市,府中愛児園,1830016,府中市八幡町3丁目18番地,,
東京都,府中市,白糸さくらんぼ保育園,1830011,府中市白糸台3丁目36番地の2,042-367-4610,
東京都,府中市,緑町３－１１－５ 芳文社ビル２ そよかぜハーモニー保育園,183-0006,,042-306-9144,
東京都,文京区,こそだて応援 まちぷら 空き店舗,113-0033,東京都文京区本郷3-9-5 NK本郷ビル4階,03-6874-2108,
東京都,文京区,こまぴよのおうち 民家,113-0021,東京都文京区本駒込5-11-6,03-5809-0756,
東京都,文京区,さきちゃんちpetit 空き店舗,112-0001,東京都文京区白山2-14-17 1階,080-8012-4848,
東京都,文京区,子育てひろば千石,112-0011,東京都文京区千石１－４－３,03-3941-3931,
東京都,文京区,子育てひろば千石（児童青少年課）,1120011,文京区千石1‐4-3(千石児童館内),,
東京都,文京区,子育てひろば水道,112-0005,東京都文京区水道１－３－２６,03-3812-2345,
東京都,文京区,子育てひろば水道（保育課）,1120005,文京区水道1-3-26(水道保育園内),,
東京都,文京区,子育てひろば汐見,1130022,文京区千駄木2-19-23(汐見小学校内),03-3828-0880,
東京都,文京区,子育てひろば江戸川橋,112-0006,東京都文京区小日向2-16-15,03-5940-2909,
東京都,文京区,子育てひろば西片,1130024,文京区西片1-8-15,03-3812-2575,
東京都,文京区,音羽1-20-2 音羽ダイコクビル おひさま0・1・2 空き店舗,112-0013,,03-6902-0041,
東京都,新宿区,つどいのへや,160-0004,東京都新宿区四谷２－６,03-5369-3170,
東京都,新宿区,つどいのへや どんぐり,1690073,新宿区百人町4-7-1,03-3362-0423,
東京都,新宿区,つどいのへや（四谷子ども園）,1600004,新宿区四谷二丁目6番地,,
東京都,新宿区,ふたばひろば,160-0012,東京都新宿区南元町4,03-5363-2170,
東京都,新宿区,ゆうゆうひろば,162-0853,東京都新宿区北山伏町2-17,03-5228-4377,
東京都,新宿区,上落合児童館,1610034,新宿区上落合2-28-8,03-3360-1413,
東京都,新宿区,中井児童館,1610035,新宿区中井1-8-12,03-3361-0075,
東京都,新宿区,中落合子ども家庭支援センター,1610032,新宿区中落合2-7-24,03-3952-7751,
東京都,新宿区,信濃町子ども家庭支援センター,1600016,新宿区信濃町20,03-3357-6851,
東京都,新宿区,北山伏児童館,162-0853,東京都新宿区北山伏町2-17,03-5228-5661,
東京都,新宿区,北新宿子ども家庭支援センター,1690074,新宿区北新宿3-20-2,03-3365-1121,
東京都,新宿区,北新宿第一児童館,1690074,新宿区北新宿2-3-7,03-3369-5856,
東京都,新宿区,原町みゆきひろば,162-0053,東京都新宿区原町2-43,03-3356-2663,
東京都,新宿区,地域子育て支援センター原町みゆき,1620053,新宿区原町2-43,,
東京都,新宿区,子ども総合センター,1600022,新宿区新宿7-3-29,03-3232-0695,
東京都,新宿区,富久町児童館,1620067,新宿区富久町22-21,03-3357-7638,
東京都,新宿区,早稲田南町児童館,1620043,新宿区早稲田南町50,03-5287-4321,
東京都,新宿区,本塩町児童館,1600003,新宿区本塩町8,03-3350-1456,
東京都,新宿区,東五軒町児童館,1620813,新宿区東五軒町5-24,03-3269-6895,
東京都,新宿区,榎町子ども家庭支援センター,1620806,新宿区榎町36,03-3269-7304,
東京都,新宿区,百人町児童館,1690073,新宿区百人町2-18-21,,
東京都,新宿区,薬王寺児童館,1620063,新宿区市谷薬王寺51,03-3353-6625,
東京都,新宿区,西新宿児童館,1600023,新宿区西新宿4-35-28,03-3377-9352,
東京都,新宿区,西落合児童館,1610031,新宿区西落合1-31-24,03-3954-1042,
東京都,新宿区,高田馬場第一児童館,1690075,新宿区高田馬場3-18-21,03-3368-8167,
東京都,新宿区,高田馬場第二児童館,1690075,新宿区高田馬場1-4-17,03-3200-5038,
東京都,新島村,新島村子育て広場,100-0511,東京都新島村式根島246,04992-7-0136,
東京都,新島村,新島村子育て広場,1000402,東京都新島村本村4-11-14,04992-5-0544,
東京都,日の出町,日の出町立志茂町児童館,190-0182,東京都西多摩郡日の出町平井1254-1,042-597-2547,
東京都,日野市,あさひがおか保育園,1910065,日野市旭が丘2の42の1,042-581-7676,
東京都,日野市,あそビバいえろーひらやま児童館,1910043,日野市平山3の26の3,,
東京都,日野市,あそビバいえろ～ひらやま児童館,191-0043,東京都日野市平山3-26-3,042-592-6811,
東京都,日野市,あそビバぶるーさかえまち児童館,1910001,日野市栄町2の13の4,,
東京都,日野市,あそビバぶる～さかえまち児童館,191-0001,東京都日野市栄町2-13-4,042-585-8281,
東京都,日野市,あそビバれっどあさひがおか児童館,1910065,日野市旭が丘2の42の5,042-583-4346,
東京都,日野市,あらい保育園,1910022,日野市新井842の6,042-591-6132,
東京都,日野市,おおくぼ保育園,191-0061,東京都日野市大坂上4-10-2,042-584-3690,
東京都,日野市,しんさかした保育園,1910002,日野市新町3の17の4,042-584-8277,
東京都,日野市,たかはた台保育園,1910042,日野市程久保650,042-591-2231,
東京都,日野市,とよだ保育園,1910051,日野市豊田4の10の3,,
東京都,日野市,ひらやま保育園,1910054,日野市東平山1の7の13,042-581-9225,
東京都,日野市,みさわ保育園,1910032,日野市三沢200,042-591-6131,
東京都,日野市,みなみだいら保育園,1910043,日野市平山4の20の1,042-591-2468,
東京都,日野市,みんなのはらっぱ,1910024,日野市万願寺4の20の12 万願寺交流ｾﾝﾀｰ,042-587-6276,
東京都,日野市,もぐさ台保育園,1910033,日野市百草1002の4,042-591-0880,
東京都,日野市,万願寺2-24-7万願寺タウンビル 地域子ども家庭支援センタ-万願寺,191-0024,,042-586-1312,
東京都,日野市,吹上保育園,1910052,日野市東豊田3の12の7,,
東京都,日野市,地域子ども家庭支援センター万願寺,1910024,日野市万願寺2-24-7万願寺ﾀｳﾝﾋﾞﾙ2階,,
東京都,日野市,地域子ども家庭支援センター多摩平,1910062,日野市多摩平2-9多摩平の森ふれあい館2階,,
東京都,日野市,多摩平2-9多摩平の森ふれあい 地域子ども家庭支援センタ-多摩平,191-0062,,042-589-1260,
東京都,日野市,子ども包括支援センターみらいく子育てひろ,191-0016,,042-506-2156,
東京都,日野市,子育てひろば「至誠スマイル」,1910012,日野市日野1183の3,042-581-0448,
東京都,日野市,日野市立次世代育成型子育てひろば平山「ぽっかぽか」,1910043,日野市平山5の18の2 平山季重すえしげふれあい館2階,,
東京都,日野市,日野市立次世代育成型子育てひろば程久保「あかいやね」,1910042,日野市程久保876の2,,
東京都,日野市,次世代育成型子育てひろば平山「ぽっかぽ,191-0043,東京都日野市平山5-18-2,042-591-7812,
東京都,日野市,次世代育成型子育てひろば程久保「あかい,191-0042,東京都日野市程久保876-2,042-594-7841,
東京都,昭島市,あきみ保育園,196-0011,東京都昭島市上川原町1-10-18,042-519-4010,
東京都,昭島市,あけの星幼稚園,1960034,昭島市玉川町3-11-2,042-544-0853,
東京都,昭島市,つつじが丘保育園,1960012,昭島市つつじが丘3-6-23,042-544-8527,
東京都,昭島市,つどいのひろばくるみ,1960002,昭島市拝島町2-4-26  拝島保育園2階,042-541-1074,
東京都,昭島市,つどいのひろばさくらんぼ,1960015,昭島市昭和町4-8-11上友自治会館2階集会室,,
東京都,昭島市,のぞみこども園,196-0003,東京都昭島市松原町5-11-7,042-541-1565,
東京都,昭島市,のぞみ保育園,1960003,昭島市松原町5-7-17,,
東京都,昭島市,むさしの保育園,1960022,昭島市中神町1294-4,042-543-8280,
東京都,昭島市,ゆりかご保育園,196-0003,東京都昭島市松原町2-9-2,042-544-3619,
東京都,昭島市,わかくさ保育園,1960034,昭島市玉川町5-15-26,042-544-0055,
東京都,昭島市,上川原町1-23-1 なしのき保育 子育てひろば なしのき,196-0011,,042-543-6716,
東京都,昭島市,中神保育園,1960025,昭島市朝日町5-4-17,042-545-0255,
東京都,昭島市,公私連携型なしのき保育園,196-0011,東京都昭島市上川原町1-23-1,042-543-6670,
東京都,昭島市,副島保育園,196-0031,東京都昭島市福島町1-18-8,042-544-2277,
東京都,昭島市,同援はいじま保育園,196-0003,東京都昭島市松原町5-2-25,042-543-1166,
東京都,昭島市,啓明学園幼稚園,1960002,昭島市拝島町3-8-13,,
東京都,昭島市,多摩保育園,2060001,多摩市和田418-1,042-544-1151,
東京都,昭島市,子育てひろば なしのき,1960011,昭島市上川原町1-23-1 なしのき保育園内,,
東京都,昭島市,子育てひろばほりむこう,1960001,昭島市美堀町2-6-11,042-541-2277,
東京都,昭島市,拝島保育園,1960002,昭島市拝島町2-4-26,042-541-1074,
東京都,昭島市,昭和保育園,1960024,昭島市宮沢町2-28-18,,
東京都,昭島市,昭和郷保育園,1960022,昭島市中神町1260,042-543-1588,
東京都,昭島市,昭和郷第二保育園,1960022,昭島市中神町1260,042-541-5983,
東京都,昭島市,昭島ナオミこども園,196-0034,東京都昭島市玉川町1-10-4,042-545-3561,
東京都,昭島市,昭島ナオミ保育園,1960034,昭島市玉川町1-10-4,,
東京都,昭島市,昭島幼稚園,1960022,昭島市中神町1232,042-541-0753,
東京都,昭島市,昭栄保育園,1960002,昭島市拝島町3-17-11,042-544-1401,
東京都,昭島市,松原保育園,1960003,昭島市松原町4-11-3,042-541-1227,
東京都,昭島市,栗ノ沢幼稚園,1960014,昭島市田中町1-25-27,,
東京都,昭島市,福島保育園,1960031,昭島市福島町1-18-8,,
東京都,昭島市,認定こども園イコロ昭和の森,1960002,昭島市拝島町4041-1,042-545-0156,
東京都,昭島市,認定こども園ミナパもくせいのもり,196-0035,東京都昭島市もくせいの杜1-2-25,042-519-4378,
東京都,杉並区,NPO法人八成グループひととき保育八成（つどいの広場併設）,1670021,杉並区井草2丁目27番13号,,
東京都,杉並区,つどいの広場八成 民家,167-0021,東京都杉並区井草2-27-13,03-6915-0233,
東京都,杉並区,上荻3-26-14 ドミトリー上荻Ⅱ1 つどいの広場上荻 民家,167-0043,,03-3395-0135,
東京都,杉並区,上荻児童館,1670043,杉並区上荻1-20-13,03-3392-2356,
東京都,杉並区,下井草児童館,1670022,杉並区下井草3-13-9,,
東京都,杉並区,今川児童館,1670035,杉並区今川3-3-18,03-3394-5302,
東京都,杉並区,和泉児童館,1680063,杉並区和泉2-36-14,,
東京都,杉並区,堀ノ内東児童館,1660013,杉並区堀ﾉ内3-49-19-101,03-3315-7923,
東京都,杉並区,子ども・子育てプラザ下井草,167-0022,東京都杉並区下井草3-13-9,03-3396-8888,
東京都,杉並区,子ども・子育てプラザ下高井戸,168-0073,東京都杉並区下高井戸4-19-6,03-3304-0260,
東京都,杉並区,子ども・子育てプラザ和泉,168-0063,東京都杉並区和泉2-36-14,03-3328-6550,
東京都,杉並区,子ども・子育てプラザ善福寺,167-0041,東京都杉並区善福寺1-18-9,03-3395-1576,
東京都,杉並区,子ども・子育てプラザ天沼,167-0032,東京都杉並区天沼3-19-16 ｳｪﾙﾌｧｰﾑ杉並1階,03-5335-7319,
東京都,杉並区,子ども・子育てプラザ成田西,166-0016,東京都杉並区成田西3-10-38,03-3391-1857,
東京都,杉並区,子ども・子育てプラザ高円寺,166-0003,東京都杉並区高円寺南2-52-2,03-3315-0395,
東京都,杉並区,株式会社 ニリア・バニーひととき保育宮前（つどいの広場併設）,1680081,杉並区宮前5丁目24番18号,,
東京都,杉並区,阿佐谷南児童館,166-0004,東京都杉並区阿佐谷南1-14-8,03-3315-0439,
東京都,杉並区,高井戸児童館,1680071,杉並区高井戸西2-5-10,03-3334-0902,
東京都,杉並区,高円寺中央児童館,1660003,杉並区高円寺南2-52-2,,
東京都,東久留米市,地域子ども家庭支援センター上の原,2030001,東久留米市上の原1-2-44,042-420-9011,
東京都,東久留米市,地域子育てひろば上の原,203-0001,東京都東久留米市上の原１－２－４４,042-420-9011,
東京都,東久留米市,地域子育て支援センターはこぶね館,2030043,東久留米市下里7-8-20,042-474-2977,
東京都,東大和市,かみきただい児童館子育てひろば,207-0023,東京都東大和市上北台2-865-9,042-567-2884,
東京都,東大和市,きよはら児童館子育てひろば,207-0011,東京都東大和市清原2-1,042-565-6021,
東京都,東大和市,さくらがおか児童館子育てひろば,207-0022,東京都東大和市桜が丘3-44-13,042-567-2237,
東京都,東大和市,ならはし児童館子育てひろば,207-0031,東京都東大和市奈良橋4-600,042-562-3600,
東京都,東大和市,なんがい児童館子育てひろば,207-0014,東京都東大和市南街5-32,042-567-2441,
東京都,東大和市,むこうはら児童館子育てひろば,207-0013,東京都東大和市向原3-10,042-563-1858,
東京都,東大和市,れんげ上北台保育園内 子育てひろば,207-0032,東京都東大和市蔵敷3-691-2,042-563-3990,
東京都,東大和市,大和南保育園内子育てひろば（子育て支援センター・ポケット）,2070011,東大和市清原3-1,,
東京都,東大和市,大和南子育て支援センター ぽけっと 独立専用施設,207-0011,東京都東大和市清原3-1,042-565-3450,
東京都,東大和市,子育て支援センター ちきんえっぐ,207-0021,東京都東大和市立野3-1255-3,042-569-8376,
東京都,東大和市,玉川上水保育園内子育てひろば（にこにこ広,207-0022,東京都東大和市桜が丘4-29-18,042-566-8672,
東京都,東大和市,玉川上水保育園内子育てひろば（にこにこ広場）,2070022,東大和市桜が丘4-29-18,,
東京都,東大和市,誠愛保育園内子育てひろば,2070032,東大和市蔵敷3-691-2,,
東京都,東村,(福）村山苑ほほえみ子育てひろば,1890014,東村山市本町3丁目43番地1 ほんちょう保育園,,
東京都,東村,東村山市子どもＮＰＯユニット,1890022,東村山市野口町1丁目25番地15,,
東京都,東村,（特非）ＨＵＧこどもパートナーズ,1890022,東村山市野口町2丁目4番地36,,
東京都,東村山市,のぐちちょう子育てひろば 空き店舗,189-0022,東京都東村山市野口町2-4-36,042-393-4181,
東京都,東村山市,ほほえみ子育てひろば,189-0014,東京都東村山市本町3-43-1,042-399-2100,
東京都,東村山市,ほんちょう子育てひろば,1890014,東村山市本町4丁目19−26 東村山市役所 本町児童館,042-397-1154,
東京都,東村山市,みすみ子育てひろば,1890023,東村山市美住町1丁目4−1 東村山市立第四保育園,042-394-1211,
東京都,東村山市,東村山市子育て総合支援センター,189-0022,東京都東村山市野口町1-25-15,042-395-7280,
東京都,板橋区,あずさわ児童館,1740051,板橋区小豆沢3丁目9番2-103号,,
東京都,板橋区,あずさわ児童館 すくすくサロン,174-0051,東京都板橋区小豆沢３－９－２－１０３,03-3966-2825,
東京都,板橋区,さかうえ児童館,1740051,板橋区小豆沢1丁目20番17号,,
東京都,板橋区,さかうえ児童館 すくすくサロン,174-0051,東京都板橋区小豆沢１－２０－１７,03-3965-9733,
東京都,板橋区,しらさぎ児童館,1750094,板橋区成増5丁目19番41号,,
東京都,板橋区,しらさぎ児童館 すくすくサロン,175-0094,東京都板橋区成増５－１９－４１,03-3979-3895,
東京都,板橋区,なります児童館,1750094,板橋区成増3丁目34番21号,,
東京都,板橋区,なります児童館 子育て相談エール,175-0094,東京都板橋区成増３－３４－２１,03-3939-6502,
東京都,板橋区,はすのみ児童館,1750082,板橋区高島平1丁目50番2号,,
東京都,板橋区,はすのみ児童館 子育て相談エール,175-0082,東京都板橋区高島平１－５０－２,03-3934-5980,
東京都,板橋区,ゆりの木児童館,1750093,板橋区赤塚新町3丁目32番11-209号,,
東京都,板橋区,ゆりの木児童館 すくすくサロン,175-0093,東京都板橋区赤塚新町３－２２－１１－２０９,03-3977-2651,
東京都,板橋区,上板橋児童館,1740076,板橋区上板橋2丁目3番8号,,
東京都,板橋区,上板橋児童館 子育て相談エール,174-0076,東京都板橋区上板橋２－３－８,03-3933-6970,
東京都,板橋区,南前野児童館,1740063,板橋区前野町2丁目23番1号,,
東京都,板橋区,南前野児童館 すくすくサロン,174-0063,東京都板橋区前野町２－２３－１,03-3967-3870,
東京都,板橋区,南板橋児童館,1730004,板橋区板橋1丁目39番1号,,
東京都,板橋区,南板橋児童館 ほっとサロン,173-0004,東京都板橋区板橋１－３９－１,03-3963-4518,
東京都,板橋区,向原児童館,1730036,板橋区向原1丁目18番5号,,
東京都,板橋区,向原児童館 すくすくサロン,173-0036,東京都板橋区向原１－１８－５,03-3974-6736,
東京都,板橋区,大山東児童館,1730014,板橋区大山東町8番7号,,
東京都,板橋区,大山東児童館 子育て相談エール,173-0014,東京都板橋区大山東町８－７,03-3579-6767,
東京都,板橋区,富士見台児童館,1740063,板橋区前野町1丁目8番1号,,
東京都,板橋区,弥生児童館 すくすくサロン,173-0021,東京都板橋区弥生町１６－２,03-3956-8311,
東京都,板橋区,志村児童館,1740056,板橋区志村2丁目16番11号,,
東京都,板橋区,志村児童館 ほっとサロン,174-0056,東京都板橋区志村２－１６－１１,03-3969-5881,
東京都,板橋区,志村橋児童館,1740041,板橋区舟渡3丁目6番3号,,
東京都,板橋区,志村橋児童館 すくすくサロン,174-0041,東京都板橋区舟渡３－６－３,03-3966-6849,
東京都,板橋区,新河岸児童館,1750081,板橋区新河岸1丁目3番2-101号,,
東京都,板橋区,新河岸児童館 すくすくサロン,175-0081,東京都板橋区新河岸１－３－２－１０１,03-3937-8337,
東京都,板橋区,東新児童館,1740074,板橋区東新町2丁目43番5号,,
東京都,板橋区,森のサロン,173-8602,東京都板橋区加賀１－１８－１,03-3961-5274,
東京都,板橋区,氷川児童館,1730013,板橋区氷川町24番2号,,
東京都,板橋区,氷川児童館 すくすくサロン,173-0013,東京都板橋区氷川町２４－２,03-3961-5723,
東京都,板橋区,清水児童館,1740053,板橋区清水町72番7号,,
東京都,板橋区,清水児童館 子育て相談エール,174-0053,東京都板橋区清水町７２－７,03-3963-3313,
東京都,板橋区,紅梅児童館,1750083,板橋区徳丸6丁目2番10号,,
東京都,板橋区,紅梅児童館 すくすくサロン,175-0083,東京都板橋区徳丸６－２－１０,03-3934-6477,
東京都,板橋区,緑が丘児童館 すくすくサロン,174-0064,東京都板橋区中台３－２７－２,03-3934-4176,
東京都,板橋区,蓮根児童館,1740046,板橋区蓮根2丁目6番15号,,
東京都,板橋区,蓮根第二児童館,1740046,板橋区蓮根3丁目15番1-104号,,
東京都,板橋区,蓮根第二児童館 すくすくサロン,174-0046,東京都板橋区蓮根３－１５－１－１０４,03-3969-5582,
東京都,板橋区,西徳児童館,1750045,板橋区西台4丁目4番37号,,
東京都,板橋区,西徳児童館 ほっとサロン,175-0045,東京都板橋区西台４－４－３７,03-3936-2409,
東京都,板橋区,赤塚児童館,1750092,板橋区赤塚6丁目38番1号,,
東京都,板橋区,赤塚児童館 ほっとサロン,175-0092,東京都板橋区赤塚６－３８－１,03-3938-8821,
東京都,板橋区,高島平児童館,1750082,板橋区高島平3丁目12番28号,,
東京都,板橋区,高島平児童館 ほっとサロン,175-0082,東京都板橋区高島平３－１２－２８,03-3979-3894,
東京都,武蔵村,地域子育て支援センター,2080003,武蔵村山市中央一丁目28番地,,
東京都,武蔵村,子育て支援センター,2080012,武蔵村山市緑が丘1732-1れんげ武蔵保育園,,
東京都,武蔵村山市,おひさまくらぶ,208-0021,武蔵村山市三ツ藤三丁目36番地の10,042-560-3564,
東京都,武蔵村山市,さくらんぼくらぶ,208-0013,武蔵村山市榎二丁目36番地の1,042-562-3232,
東京都,武蔵村山市,にこにこクラブ,208-0012,武蔵村山市緑が丘1732番地の1,042-561-3959,
東京都,武蔵村山市,にじいろひろば,208-0013,武蔵村山市大南三丁目94番地の1,042-566-5605,
東京都,武蔵村山市,地域子育て支援センター タンポポの会,208-0003,武蔵村山市中央一丁目28番地の1,042-562-3143,
東京都,武蔵野市,おもちゃのぐるりん,1800012,武蔵野市緑町2-6-8   武蔵野緑町二丁目第3ｱﾊﾟ-ﾄ1階,,
東京都,武蔵野市,すくすく泉,180-0004,武蔵野市吉祥寺本町3-27-17,0422-77-0213,
東京都,武蔵野市,とことこおやこひろば,180-0014,武蔵野市関前4-17-10,0422-27-7195,
東京都,武蔵野市,ひまわりこそだてひろば RAKURU 民家,180-0023,武蔵野市境南町2-17-3,0422-90-3084,
東京都,武蔵野市,みずきっこ,180-0001,武蔵野市吉祥寺北町4-1-16,0422-38-5150,
東京都,武蔵野市,公益財団法人武蔵野市子ども協会０１２３はらっぱ,1800011,武蔵野市八幡町1-3-24,,
東京都,武蔵野市,公益財団法人武蔵野市子ども協会０１２３吉祥寺,1800002,武蔵野市吉祥寺東町2-29-12,,
東京都,武蔵野市,境こども園子育て支援ルームいこっと,1800022,武蔵野市境4-11-6,0422-53-2312,
東京都,武蔵野市,桜堤児童館,1800021,武蔵野市桜堤2-1-29,0422-53-2206,
東京都,武蔵野市,武蔵野市立０１２３はらっぱ 独立専用施設,180-0011,武蔵野市八幡町1-3-24,0422-56-3210,
東京都,武蔵野市,武蔵野市立０１２３吉祥寺 独立専用施設,180-0002,東京都武蔵野市吉祥寺東町2-29-12,0422-20-3210,
東京都,武蔵野市,緑町2-6-8 武蔵野緑町二丁目第3ア おもちゃのぐるりん,180-0012,,0422-37-2016,
東京都,江戸川区,ベーテルひろば 民家,134-0084,江戸川区東葛西8-11-33 エストパル1Ｃ号室,03-3686-8350,
東京都,江戸川区,中葛西子育てひろば,1340083,江戸川区中葛西1丁目2番8号,,
東京都,江戸川区,人権・男女共同参画推進センター,1320011,江戸川区瑞江2-9-15,,
東京都,江戸川区,共育プラザ一之江子育てひろば,132-0024,江戸川区一之江3-13-7,03-5652-5911,
東京都,江戸川区,共育プラザ中央子育てひろば,132-0031,江戸川区松島1-38-1,03-5662-7661,
東京都,江戸川区,共育プラザ南小岩子育てひろば,133-0056,江戸川区南小岩4-5-8,03-3673-2206,
東京都,江戸川区,共育プラザ南篠崎子育てひろば,133-0065,江戸川区南篠崎町3-12-8,03-3678-8241,
東京都,江戸川区,共育プラザ小岩子育てひろば,133-0051,江戸川区北小岩2-14-17,03-3672-0604,
東京都,江戸川区,共育プラザ平井子育てひろば,132-0035,江戸川区平井7-21-6,03-3618-4031,
東京都,江戸川区,共育プラザ葛西子育てひろば,134-0082,江戸川区宇喜田町175,03-3688-8611,
東京都,江戸川区,堀江らっこルーム,1340085,江戸川区南葛西3-16-8 公社堀江住宅8号棟1階,,
東京都,江戸川区,子育てひろば（なぎさ健康サポートセンター）,1340085,江戸川区南葛西7丁目1番27号,,
東京都,江戸川区,子育てひろば（グリーンパレス）,1320031,江戸川区松島1丁目38番1号,,
東京都,江戸川区,子育てひろば（中央健康サポートセンター）,1320021,江戸川区中央4丁目24番19号,,
東京都,江戸川区,子育てひろば（共育プラザ一之江）,1320024,江戸川区一之江3丁目13番7号,,
東京都,江戸川区,子育てひろば（共育プラザ南小岩）,1330056,江戸川区南小岩4丁目5番8号,,
東京都,江戸川区,子育てひろば（共育プラザ南篠崎）,1330065,江戸川区南篠崎町3丁目12番8号,,
東京都,江戸川区,子育てひろば（共育プラザ小岩）,1330051,江戸川区北小岩2丁目14番17号,,
東京都,江戸川区,子育てひろば（共育プラザ平井）,1320035,江戸川区平井7丁目21番6号,,
東京都,江戸川区,子育てひろば（共育プラザ葛西）,1340082,江戸川区宇喜田町175番地,,
